{
  "id": "carousel-gridpreview-travel",
  "name": "Trip Grid",
  "category": "travel",
  "isPremium": false,
  "carouselType": "gridPreview",
  "canvasAspectRatio": "4:5",
  "frameCount": 5,
  "frames": [
    {
      "index": 0,
      "cells": [
        {
          "type": "photo",
          "shape": "rectangle",
          "frame": {
            "x": 0.0,
            "y": 0.0,
            "width": 0.5,
            "height": 0.5
          }
        },
        {
          "type": "photo",
          "shape": "rectangle",
          "frame": {
            "x": 0.5,
            "y": 0.0,
            "width": 0.5,
            "height": 0.5
          }
        },
        {
          "type": "photo",
          "shape": "rectangle",
          "frame": {
            "x": 0.0,
            "y": 0.5,
            "width": 0.5,
            "height": 0.5
          }
        },
        {
          "type": "photo",
          "shape": "rectangle",
          "frame": {
            "x": 0.5,
            "y": 0.5,
            "width": 0.5,
            "height": 0.5
          }
        }
      ]
    },
    {
      "index": 1,
      "cells": [
        {
          "type": "photo",
          "shape": "rectangle",
          "frame": {
            "x": 0,
            "y": 0,
            "width": 1,
            "height": 1
          }
        }
      ]
    },
    {
      "index": 2,
      "cells": [
        {
          "type": "photo",
          "shape": "rectangle",
          "frame": {
            "x": 0,
            "y": 0,
            "width": 1,
            "height": 1
          }
        }
      ]
    },
    {
      "index": 3,
      "cells": [
        {
          "type": "photo",
          "shape": "rectangle",
          "frame": {
            "x": 0,
            "y": 0,
            "width": 1,
            "height": 1
          }
        }
      ]
    },
    {
      "index": 4,
      "cells": [
        {
          "type": "photo",
          "shape": "rectangle",
          "frame": {
            "x": 0,
            "y": 0,
            "width": 1,
            "height": 1
          }
        }
      ]
    }
  ],
  "background": {
    "type": "solid",
    "color": "#FFFFFF"
  }
}