{
  "id": "carousel-matched-menu",
  "name": "Menu Cards",
  "category": "product",
  "isPremium": false,
  "carouselType": "matched",
  "canvasAspectRatio": "4:5",
  "frameCount": 4,
  "frames": [
    {
      "index": 0,
      "cells": [
        {
          "type": "photo",
          "shape": "rectangle",
          "frame": {
            "x": 0.06,
            "y": 0.06,
            "width": 0.88,
            "height": 0.62
          }
        },
        {
          "type": "text",
          "shape": "rectangle",
          "frame": {
            "x": 0.08,
            "y": 0.72,
            "width": 0.84,
            "height": 0.2
          },
          "text": "Dish 1",
          "fontName": "AvenirNext-Bold",
          "fontSize": 96,
          "color": "#111111",
          "alignment": "center"
        }
      ]
    },
    {
      "index": 1,
      "cells": [
        {
          "type": "photo",
          "shape": "rectangle",
          "frame": {
            "x": 0.06,
            "y": 0.06,
            "width": 0.88,
            "height": 0.62
          }
        },
        {
          "type": "text",
          "shape": "rectangle",
          "frame": {
            "x": 0.08,
            "y": 0.72,
            "width": 0.84,
            "height": 0.2
          },
          "text": "Dish 2",
          "fontName": "AvenirNext-Bold",
          "fontSize": 96,
          "color": "#111111",
          "alignment": "center"
        }
      ]
    },
    {
      "index": 2,
      "cells": [
        {
          "type": "photo",
          "shape": "rectangle",
          "frame": {
            "x": 0.06,
            "y": 0.06,
            "width": 0.88,
            "height": 0.62
          }
        },
        {
          "type": "text",
          "shape": "rectangle",
          "frame": {
            "x": 0.08,
            "y": 0.72,
            "width": 0.84,
            "height": 0.2
          },
          "text": "Dish 3",
          "fontName": "AvenirNext-Bold",
          "fontSize": 96,
          "color": "#111111",
          "alignment": "center"
        }
      ]
    },
    {
      "index": 3,
      "cells": [
        {
          "type": "photo",
          "shape": "rectangle",
          "frame": {
            "x": 0.06,
            "y": 0.06,
            "width": 0.88,
            "height": 0.62
          }
        },
        {
          "type": "text",
          "shape": "rectangle",
          "frame": {
            "x": 0.08,
            "y": 0.72,
            "width": 0.84,
            "height": 0.2
          },
          "text": "Dish 4",
          "fontName": "AvenirNext-Bold",
          "fontSize": 96,
          "color": "#111111",
          "alignment": "center"
        }
      ]
    }
  ],
  "background": {
    "type": "solid",
    "color": "#FFFFFF"
  }
}