{
  "id": "carousel-matched-quotes",
  "name": "Quote Set",
  "category": "quote",
  "isPremium": true,
  "carouselType": "matched",
  "canvasAspectRatio": "1:1",
  "frameCount": 3,
  "frames": [
    {
      "index": 0,
      "cells": [
        {
          "type": "photo",
          "shape": "rectangle",
          "frame": {
            "x": 0.06,
            "y": 0.06,
            "width": 0.88,
            "height": 0.62
          }
        },
        {
          "type": "text",
          "shape": "rectangle",
          "frame": {
            "x": 0.08,
            "y": 0.72,
            "width": 0.84,
            "height": 0.2
          },
          "text": "Words 1",
          "fontName": "AvenirNext-Bold",
          "fontSize": 96,
          "color": "#FFFFFF",
          "alignment": "center"
        }
      ]
    },
    {
      "index": 1,
      "cells": [
        {
          "type": "photo",
          "shape": "rectangle",
          "frame": {
            "x": 0.06,
            "y": 0.06,
            "width": 0.88,
            "height": 0.62
          }
        },
        {
          "type": "text",
          "shape": "rectangle",
          "frame": {
            "x": 0.08,
            "y": 0.72,
            "width": 0.84,
            "height": 0.2
          },
          "text": "Words 2",
          "fontName": "AvenirNext-Bold",
          "fontSize": 96,
          "color": "#FFFFFF",
          "alignment": "center"
        }
      ]
    },
    {
      "index": 2,
      "cells": [
        {
          "type": "photo",
          "shape": "rectangle",
          "frame": {
            "x": 0.06,
            "y": 0.06,
            "width": 0.88,
            "height": 0.62
          }
        },
        {
          "type": "text",
          "shape": "rectangle",
          "frame": {
            "x": 0.08,
            "y": 0.72,
            "width": 0.84,
            "height": 0.2
          },
          "text": "Words 3",
          "fontName": "AvenirNext-Bold",
          "fontSize": 96,
          "color": "#FFFFFF",
          "alignment": "center"
        }
      ]
    }
  ],
  "background": {
    "type": "solid",
    "color": "#161618"
  }
}